{"affected_ars":[{"after_revision":3,"before_revision":2,"id":"AR-0060","reopen":true}],"after_state":"reopened","authorization":"non_authorizing","before_state":"pending_clarification","discussion_id":"DISC-AR0060-001","event_refs":["EV-AR0060-DISCUSSION"],"formal_spec":{"result_sha256":"9999999999999999999999999999999999999999999999999999999999999999","review_sha256":"aaaaaaaaaaaaaaaaaaaaaaaaaaaaaaaaaaaaaaaaaaaaaaaaaaaaaaaaaaaaaaaa","specification_sha256":"8888888888888888888888888888888888888888888888888888888888888888","status":"pass","task_revision":3},"issue":"contradiction","limitations":["consumer_native_gates_remain_authoritative","formal_refinement_not_proven","implementation_correctness_not_proven","user_intent_not_proven"],"privacy_projection":{"projection_sha256":"cccccccccccccccccccccccccccccccccccccccccccccccccccccccccccccccc","public_safe":true,"redacted_fields":["guidance","transcript","private_references"]},"schema_version":1,"task":{"id":"AR-0060","revision":3},"user_result":"reopen"}
